{
  "by_metric": {
    "accuracy": {
      "artifact_exact_rate": 1.0,
      "fn": 0,
      "fp": 0,
      "precision": 1.0,
      "precision_wilson_95": [
        0.5100999795960008,
        1.0
      ],
      "recall": 1.0,
      "recall_wilson_95": [
        0.5100999795960008,
        1.0
      ],
      "tp": 4
    },
    "miou": {
      "artifact_exact_rate": 1.0,
      "fn": 0,
      "fp": 0,
      "precision": 1.0,
      "precision_wilson_95": [
        0.9848062976978471,
        1.0
      ],
      "recall": 1.0,
      "recall_wilson_95": [
        0.9848062976978471,
        1.0
      ],
      "tp": 249
    },
    "top1_accuracy": {
      "artifact_exact_rate": 1.0,
      "fn": 0,
      "fp": 0,
      "precision": 1.0,
      "precision_wilson_95": [
        0.8453561767357979,
        0.9999999999999999
      ],
      "recall": 1.0,
      "recall_wilson_95": [
        0.8453561767357979,
        0.9999999999999999
      ],
      "tp": 21
    },
    "top5_accuracy": {
      "artifact_exact_rate": 1.0,
      "fn": 0,
      "fp": 0,
      "precision": 1.0,
      "precision_wilson_95": [
        0.8453561767357979,
        0.9999999999999999
      ],
      "recall": 1.0,
      "recall_wilson_95": [
        0.8453561767357979,
        0.9999999999999999
      ],
      "tp": 21
    }
  },
  "by_repository": {
    "fairseq": {
      "artifact_exact_rate": 1.0,
      "fn": 0,
      "fp": 0,
      "precision": 1.0,
      "precision_wilson_95": [
        0.5100999795960008,
        1.0
      ],
      "recall": 1.0,
      "recall_wilson_95": [
        0.5100999795960008,
        1.0
      ],
      "tp": 4
    },
    "mmsegmentation": {
      "artifact_exact_rate": 1.0,
      "fn": 0,
      "fp": 0,
      "precision": 1.0,
      "precision_wilson_95": [
        0.9848062976978471,
        1.0
      ],
      "recall": 1.0,
      "recall_wilson_95": [
        0.9848062976978471,
        1.0
      ],
      "tp": 249
    },
    "paddleclas": {
      "artifact_exact_rate": 1.0,
      "fn": 0,
      "fp": 0,
      "precision": 1.0,
      "precision_wilson_95": [
        0.7574992425007574,
        1.0
      ],
      "recall": 1.0,
      "recall_wilson_95": [
        0.7574992425007574,
        1.0
      ],
      "tp": 12
    },
    "timm": {
      "artifact_exact_rate": 1.0,
      "fn": 0,
      "fp": 0,
      "precision": 1.0,
      "precision_wilson_95": [
        0.8864829086095221,
        1.0
      ],
      "recall": 1.0,
      "recall_wilson_95": [
        0.8864829086095221,
        1.0
      ],
      "tp": 30
    }
  },
  "cases": [
    {
      "exact": true,
      "expected_claims": 0,
      "extracted_scoped_claims": 0,
      "fn": 0,
      "fp": 0,
      "local_path": "fairseq/README.md",
      "repository": "fairseq",
      "tp": 0
    },
    {
      "exact": true,
      "expected_claims": 0,
      "extracted_scoped_claims": 0,
      "fn": 0,
      "fp": 0,
      "local_path": "fairseq/examples/MMPT/README.md",
      "repository": "fairseq",
      "tp": 0
    },
    {
      "exact": true,
      "expected_claims": 0,
      "extracted_scoped_claims": 0,
      "fn": 0,
      "fp": 0,
      "local_path": "fairseq/examples/conv_seq2seq/README.md",
      "repository": "fairseq",
      "tp": 0
    },
    {
      "exact": true,
      "expected_claims": 0,
      "extracted_scoped_claims": 0,
      "fn": 0,
      "fp": 0,
      "local_path": "fairseq/examples/hubert/README.md",
      "repository": "fairseq",
      "tp": 0
    },
    {
      "exact": true,
      "expected_claims": 0,
      "extracted_scoped_claims": 0,
      "fn": 0,
      "fp": 0,
      "local_path": "fairseq/examples/linformer/README.md",
      "repository": "fairseq",
      "tp": 0
    },
    {
      "exact": true,
      "expected_claims": 0,
      "extracted_scoped_claims": 0,
      "fn": 0,
      "fp": 0,
      "local_path": "fairseq/examples/m2m_100/README.md",
      "repository": "fairseq",
      "tp": 0
    },
    {
      "exact": true,
      "expected_claims": 0,
      "extracted_scoped_claims": 0,
      "fn": 0,
      "fp": 0,
      "local_path": "fairseq/examples/mms/lid_rerank/README.md",
      "repository": "fairseq",
      "tp": 0
    },
    {
      "exact": true,
      "expected_claims": 0,
      "extracted_scoped_claims": 0,
      "fn": 0,
      "fp": 0,
      "local_path": "fairseq/examples/pay_less_attention_paper/README.md",
      "repository": "fairseq",
      "tp": 0
    },
    {
      "exact": true,
      "expected_claims": 4,
      "extracted_scoped_claims": 4,
      "fn": 0,
      "fp": 0,
      "local_path": "fairseq/examples/roberta/README.md",
      "repository": "fairseq",
      "tp": 4
    },
    {
      "exact": true,
      "expected_claims": 0,
      "extracted_scoped_claims": 0,
      "fn": 0,
      "fp": 0,
      "local_path": "fairseq/examples/speech_recognition/README.md",
      "repository": "fairseq",
      "tp": 0
    },
    {
      "exact": true,
      "expected_claims": 0,
      "extracted_scoped_claims": 0,
      "fn": 0,
      "fp": 0,
      "local_path": "fairseq/examples/textless_nlp/dgslm/vocoder_hifigan/README.md",
      "repository": "fairseq",
      "tp": 0
    },
    {
      "exact": true,
      "expected_claims": 0,
      "extracted_scoped_claims": 0,
      "fn": 0,
      "fp": 0,
      "local_path": "fairseq/examples/textless_nlp/gslm/metrics/README.md",
      "repository": "fairseq",
      "tp": 0
    },
    {
      "exact": true,
      "expected_claims": 0,
      "extracted_scoped_claims": 0,
      "fn": 0,
      "fp": 0,
      "local_path": "fairseq/examples/translation/README.md",
      "repository": "fairseq",
      "tp": 0
    },
    {
      "exact": true,
      "expected_claims": 22,
      "extracted_scoped_claims": 22,
      "fn": 0,
      "fp": 0,
      "local_path": "mmsegmentation/configs/bisenetv1/README.md",
      "repository": "mmsegmentation",
      "tp": 22
    },
    {
      "exact": true,
      "expected_claims": 8,
      "extracted_scoped_claims": 8,
      "fn": 0,
      "fp": 0,
      "local_path": "mmsegmentation/configs/bisenetv2/README.md",
      "repository": "mmsegmentation",
      "tp": 8
    },
    {
      "exact": true,
      "expected_claims": 4,
      "extracted_scoped_claims": 4,
      "fn": 0,
      "fp": 0,
      "local_path": "mmsegmentation/configs/cgnet/README.md",
      "repository": "mmsegmentation",
      "tp": 4
    },
    {
      "exact": true,
      "expected_claims": 84,
      "extracted_scoped_claims": 84,
      "fn": 0,
      "fp": 0,
      "local_path": "mmsegmentation/configs/deeplabv3plus/README.md",
      "repository": "mmsegmentation",
      "tp": 84
    },
    {
      "exact": true,
      "expected_claims": 20,
      "extracted_scoped_claims": 20,
      "fn": 0,
      "fp": 0,
      "local_path": "mmsegmentation/configs/dnlnet/README.md",
      "repository": "mmsegmentation",
      "tp": 20
    },
    {
      "exact": true,
      "expected_claims": 2,
      "extracted_scoped_claims": 2,
      "fn": 0,
      "fp": 0,
      "local_path": "mmsegmentation/configs/dpt/README.md",
      "repository": "mmsegmentation",
      "tp": 2
    },
    {
      "exact": true,
      "expected_claims": 24,
      "extracted_scoped_claims": 24,
      "fn": 0,
      "fp": 0,
      "local_path": "mmsegmentation/configs/fastfcn/README.md",
      "repository": "mmsegmentation",
      "tp": 24
    },
    {
      "exact": true,
      "expected_claims": 32,
      "extracted_scoped_claims": 32,
      "fn": 0,
      "fp": 0,
      "local_path": "mmsegmentation/configs/gcnet/README.md",
      "repository": "mmsegmentation",
      "tp": 32
    },
    {
      "exact": true,
      "expected_claims": 9,
      "extracted_scoped_claims": 9,
      "fn": 0,
      "fp": 0,
      "local_path": "mmsegmentation/configs/mobilenet_v2/README.md",
      "repository": "mmsegmentation",
      "tp": 9
    },
    {
      "exact": true,
      "expected_claims": 28,
      "extracted_scoped_claims": 28,
      "fn": 0,
      "fp": 0,
      "local_path": "mmsegmentation/configs/nonlocal_net/README.md",
      "repository": "mmsegmentation",
      "tp": 28
    },
    {
      "exact": true,
      "expected_claims": 8,
      "extracted_scoped_claims": 8,
      "fn": 0,
      "fp": 0,
      "local_path": "mmsegmentation/configs/point_rend/README.md",
      "repository": "mmsegmentation",
      "tp": 8
    },
    {
      "exact": true,
      "expected_claims": 8,
      "extracted_scoped_claims": 8,
      "fn": 0,
      "fp": 0,
      "local_path": "mmsegmentation/configs/sem_fpn/README.md",
      "repository": "mmsegmentation",
      "tp": 8
    },
    {
      "exact": true,
      "expected_claims": 0,
      "extracted_scoped_claims": 0,
      "fn": 0,
      "fp": 0,
      "local_path": "paddleclas/README.md",
      "repository": "paddleclas",
      "tp": 0
    },
    {
      "exact": true,
      "expected_claims": 0,
      "extracted_scoped_claims": 0,
      "fn": 0,
      "fp": 0,
      "local_path": "paddleclas/docs/en/models/DPN_DenseNet_en.md",
      "repository": "paddleclas",
      "tp": 0
    },
    {
      "exact": true,
      "expected_claims": 0,
      "extracted_scoped_claims": 0,
      "fn": 0,
      "fp": 0,
      "local_path": "paddleclas/docs/en/models/ESNet_en.md",
      "repository": "paddleclas",
      "tp": 0
    },
    {
      "exact": true,
      "expected_claims": 0,
      "extracted_scoped_claims": 0,
      "fn": 0,
      "fp": 0,
      "local_path": "paddleclas/docs/en/models/EfficientNet_and_ResNeXt101_wsl_en.md",
      "repository": "paddleclas",
      "tp": 0
    },
    {
      "exact": true,
      "expected_claims": 0,
      "extracted_scoped_claims": 0,
      "fn": 0,
      "fp": 0,
      "local_path": "paddleclas/docs/en/models/HRNet_en.md",
      "repository": "paddleclas",
      "tp": 0
    },
    {
      "exact": true,
      "expected_claims": 0,
      "extracted_scoped_claims": 0,
      "fn": 0,
      "fp": 0,
      "local_path": "paddleclas/docs/en/models/LeViT_en.md",